{
  "name": "afc",
  "version": "2.8.2",
  "description": "Automated pipeline for Claude Code. Automates the full development cycle: spec → plan → implement → review → clean.",
  "author": { "name": "jhlee0409", "email": "relee6203@gmail.com" },
  "homepage": "https://github.com/jhlee0409/all-for-claudecode",
  "repository": "https://github.com/jhlee0409/all-for-claudecode",
  "license": "MIT",
  "keywords": ["pipeline", "automation", "spec", "plan", "implement", "review", "critic-loop"],
  "commands": "./commands/"
}
